ActivityID,LeadID,ActivityType,Subject,DueDate,Completed,Notes
A0001,L0033,Meeting,Customer-focused well-modulated open system,2025-06-14,False,Game tax common six collection. Fund world do ability city goal stay.
A0002,L0056,Follow-up,Extended local function,2025-06-17,False,Here direction doctor bed share perhaps foot.
A0003,L0115,Meeting,Stand-alone fresh-thinking paradigm,2025-04-02,False,Fight training expert student network night. Leg price pattern certainly none purpose cover.
A0004,L0163,Email,Profit-focused grid-enabled interface,2025-07-22,False,Art lot east.
A0005,L0073,Email,Decentralized real-time standardization,2025-06-12,True,Feel worker improve language Republican.
A0006,L0085,Follow-up,Realigned mission-critical strategy,2025-06-01,True,Interview senior community degree miss.
A0007,L0129,Email,Seamless client-driven definition,2025-08-02,False,Hard trouble its serious she general item. Region letter those.
A0008,L0155,Follow-up,Function-based bottom-line hub,2025-06-12,True,Management article answer type wife rate fall.
A0009,L0059,Follow-up,Programmable non-volatile hardware,2025-07-16,False,Whom information assume their effort strong. Hold meeting test ball act everyone company.
A0010,L0038,Follow-up,Secured directional forecast,2025-03-28,True,Recognize sea push care forget. Face fire million market per staff.
A0011,L0087,Demo,Inverse bifurcated Local Area Network,2025-03-31,True,Behavior care pattern page TV that small.
A0012,L0003,Demo,Distributed neutral knowledgebase,2025-03-19,True,Member rate mission.
A0013,L0109,Demo,Quality-focused composite leverage,2025-03-12,True,Actually trip way gas consumer picture main.
A0014,L0022,Call,Optimized mission-critical complexity,2025-06-13,True,Within behavior production him form science Mr. If care view focus deal fact nor.
A0015,L0023,Email,Enterprise-wide bifurcated focus group,2025-06-25,False,Feeling market history relate director popular walk. Try seat view lot fast five.
A0016,L0050,Call,Horizontal solution-oriented solution,2025-06-15,True,True step much education never occur police. Impact politics article finish.
A0017,L0188,Meeting,Realigned bi-directional encryption,2025-03-18,False,Social Republican group. From policy attorney bar single.
A0018,L0045,Follow-up,Customizable motivating parallelism,2025-07-10,True,Anything tree those where large think wish.
A0019,L0023,Follow-up,Synchronized composite capability,2025-07-02,True,Should tend clear reduce couple explain.
A0020,L0083,Call,Streamlined zero-defect focus group,2025-05-22,True,Magazine see early behavior theory.
A0021,L0077,Demo,Multi-tiered bottom-line access,2025-05-26,False,Court bank than day.
A0022,L0130,Call,User-centric mission-critical hierarchy,2025-05-10,False,Even feeling rule state well condition.
A0023,L0167,Meeting,Balanced bandwidth-monitored algorithm,2025-05-04,False,Article seek from safe reduce.
A0024,L0139,Follow-up,Sharable exuding model,2025-05-12,False,Ball step situation bag edge them even. Enter perform sure include.
A0025,L0056,Meeting,Enhanced asymmetric strategy,2025-03-23,True,Anyone same idea beautiful off able skill air.
A0026,L0012,Meeting,Grass-roots eco-centric focus group,2025-07-12,True,Wide blood establish rest.
A0027,L0054,Follow-up,Fundamental content-based framework,2025-03-17,False,National son produce thought company community drug.
A0028,L0184,Demo,Innovative hybrid orchestration,2025-08-03,True,Quality through identify trouble style society. Difference walk evidence.
A0029,L0155,Meeting,Intuitive homogeneous secured line,2025-03-13,True,But true necessary actually.
A0030,L0187,Follow-up,Re-engineered mission-critical budgetary management,2025-05-23,False,Relate pass record western else. Huge anyone one view movie.
A0031,L0006,Call,Organized bottom-line product,2025-03-25,False,Event against international red.
A0032,L0040,Email,Ameliorated heuristic infrastructure,2025-04-03,False,Memory news health effect market allow inside. Party great happy activity road degree study.
A0033,L0012,Call,Configurable scalable access,2025-05-12,False,Without enough east want.
A0034,L0173,Follow-up,Vision-oriented 6thgeneration groupware,2025-04-08,False,This have great response experience daughter card trial.
A0035,L0093,Email,Right-sized secondary process improvement,2025-06-19,False,Discussion culture anything hit might chair. Summer artist wife director.
A0036,L0178,Call,Organized asynchronous utilization,2025-05-31,False,Region account record force fill anyone star government. About Republican life get ability thank.
A0037,L0009,Meeting,Configurable neutral frame,2025-05-20,False,Able base sport prevent. Campaign care alone course report college growth.
A0038,L0051,Email,Customer-focused value-added open system,2025-03-23,True,Size better benefit hard over increase black collection. Evidence space yourself food.
A0039,L0045,Call,Secured even-keeled algorithm,2025-07-13,False,Seek ok help employee within prepare. Article herself ask easy sister plan huge.
A0040,L0101,Demo,Right-sized eco-centric methodology,2025-06-18,False,Green risk however whether free usually performance.
A0041,L0096,Follow-up,Total solution-oriented methodology,2025-08-01,False,Out near lawyer write develop ever. Education act agency especially.
A0042,L0067,Call,Diverse foreground adapter,2025-06-27,True,Money respond at.
A0043,L0200,Meeting,Balanced zero-defect firmware,2025-06-10,True,Avoid quite figure nice play way above. Hospital resource these born house music provide.
A0044,L0017,Meeting,Team-oriented high-level concept,2025-03-25,True,Success Congress quite stage song. Country character network continue against.
A0045,L0002,Meeting,Triple-buffered 3rdgeneration matrix,2025-04-10,False,Move fall politics appear plan. If institution by I.
A0046,L0081,Follow-up,Fundamental multi-state conglomeration,2025-05-17,True,Impact many service candidate mission eye feel. Pass face example computer tell either information people.
A0047,L0152,Call,Future-proofed dynamic protocol,2025-04-09,False,Loss campaign over. Force head left wall probably Republican.
A0048,L0071,Demo,Integrated tangible projection,2025-06-09,True,Detail range according Republican themselves southern baby say. Easy help recent.
A0049,L0035,Email,Mandatory web-enabled firmware,2025-05-25,False,Sister impact section kind try.
A0050,L0180,Call,Total 5thgeneration time-frame,2025-05-09,False,Base forward animal occur name answer result.
A0051,L0037,Email,Open-architected fresh-thinking data-warehouse,2025-06-11,False,Share product generation cold month.
A0052,L0135,Follow-up,Grass-roots stable encryption,2025-07-04,True,Husband your magazine foot specific receive.
A0053,L0068,Meeting,Profound 6thgeneration budgetary management,2025-05-14,False,Listen travel enter attention able machine thus. Rise debate cut agent media.
A0054,L0191,Demo,Robust directional Local Area Network,2025-05-04,True,Movement million weight together scientist coach.
A0055,L0089,Call,Horizontal intangible Graphic Interface,2025-06-07,False,Range certain garden lose poor health country modern.
A0056,L0059,Demo,Quality-focused intangible support,2025-04-12,True,Form would we society computer already.
A0057,L0128,Meeting,Secured multi-state implementation,2025-07-12,True,Offer return nature social building contain.
A0058,L0200,Follow-up,Down-sized asymmetric extranet,2025-06-24,True,Produce subject analysis.
A0059,L0033,Demo,Persistent system-worthy success,2025-06-19,True,Focus live individual management view. Congress majority trouble threat wall see.
A0060,L0091,Follow-up,Centralized homogeneous archive,2025-06-25,True,Challenge behind plant life focus matter hospital. Relate physical nearly case.
A0061,L0165,Meeting,Re-contextualized web-enabled framework,2025-07-28,True,Husband public PM on everything attack.
A0062,L0017,Call,Quality-focused high-level hierarchy,2025-05-17,True,Paper nice time mission network receive economic wall. Best note hear call on attorney price.
A0063,L0186,Call,Cross-group next generation task-force,2025-08-07,False,Reduce design travel rise eye. Sign resource exactly notice choose prevent.
A0064,L0052,Follow-up,Upgradable client-server open architecture,2025-04-06,False,Size watch across defense help whole government improve.
A0065,L0128,Call,Virtual contextually-based framework,2025-03-31,True,Page stay much figure. No deep gas standard marriage style candidate.
A0066,L0187,Call,Expanded stable encoding,2025-04-27,True,Sport voice great kind check like simple.
A0067,L0040,Demo,Function-based discrete time-frame,2025-04-24,True,Top pay board person guess realize person.
A0068,L0033,Follow-up,Realigned disintermediate monitoring,2025-06-19,False,Really book international mind pretty paper million.
A0069,L0074,Follow-up,Fundamental executive process improvement,2025-05-01,True,Live billion program always recognize environment. Half student suddenly up actually name fear.
A0070,L0198,Call,Persevering secondary structure,2025-07-01,False,Politics population national budget.
A0071,L0015,Call,Distributed regional Graphic Interface,2025-03-09,True,Hospital some make blue piece week hospital political. Toward under nation discover recently small second.
A0072,L0146,Demo,Up-sized content-based attitude,2025-04-11,False,List charge agency class dinner across.
A0073,L0195,Demo,Cross-group attitude-oriented interface,2025-07-08,True,Age right pull difference. Building after decade your keep.
A0074,L0073,Follow-up,Face-to-face dynamic paradigm,2025-06-26,False,Choice at since clear you more opportunity. Side natural least big while.
A0075,L0179,Email,Sharable neutral portal,2025-05-10,True,Necessary world next. Term guy something couple.
A0076,L0085,Follow-up,Operative next generation knowledge user,2025-06-13,False,Seek fund baby writer beat.
A0077,L0138,Email,Diverse holistic hardware,2025-03-11,False,Condition card watch too change east.
A0078,L0174,Meeting,Future-proofed analyzing utilization,2025-05-18,True,Watch stay similar experience move child rest understand.
A0079,L0132,Meeting,Customer-focused multimedia model,2025-07-08,False,Benefit imagine peace newspaper step course position. Wear movie whatever reach use soon.
A0080,L0021,Demo,Ameliorated context-sensitive utilization,2025-03-12,False,Officer TV author view. Attorney book across piece democratic glass whatever.
A0081,L0185,Meeting,Extended composite functionalities,2025-05-06,False,Smile ground your base life later available. Magazine section heavy area source else imagine fall.
A0082,L0123,Call,Reverse-engineered logistical collaboration,2025-05-31,True,Take grow including guess nor trial fly.
A0083,L0198,Call,Reduced content-based array,2025-04-25,False,Though direction issue state why learn policy individual.
A0084,L0060,Email,Total needs-based time-frame,2025-03-21,True,Other energy cold a alone believe plant. Effort senior call remain must.
A0085,L0041,Follow-up,Fully-configurable 4thgeneration installation,2025-05-21,True,Past develop million consider.
A0086,L0077,Meeting,Multi-layered secondary pricing structure,2025-03-27,False,Whole course improve.
A0087,L0101,Meeting,Exclusive national structure,2025-04-19,False,Dark senior arrive. Next huge scientist cover.
A0088,L0042,Meeting,Assimilated local capacity,2025-05-13,False,Different how get.
A0089,L0043,Call,Balanced composite synergy,2025-06-02,True,Way decision husband. Certain yes language evidence together.
A0090,L0141,Demo,Synergized systemic extranet,2025-06-28,False,Enjoy above impact message. Successful turn learn maybe.
A0091,L0072,Demo,Focused exuding knowledge user,2025-06-30,False,Kind explain authority reflect scientist fact industry pattern. Ready piece Democrat laugh college attack view fine.
A0092,L0188,Email,Multi-layered object-oriented initiative,2025-04-07,False,Arrive food war.
A0093,L0146,Email,Synergistic multi-state budgetary management,2025-07-16,True,Ahead you evidence peace.
A0094,L0129,Demo,Networked system-worthy flexibility,2025-05-16,True,When foreign well blue service.
A0095,L0120,Email,Quality-focused web-enabled portal,2025-04-01,True,Situation election attention source bad. Page way population.
A0096,L0177,Demo,Configurable scalable archive,2025-03-24,False,Without local at daughter subject.
A0097,L0198,Demo,Grass-roots non-volatile database,2025-07-01,False,Nor stand discussion new. Body investment tough camera ahead threat military campaign.
A0098,L0085,Email,Mandatory non-volatile collaboration,2025-04-10,True,Share laugh now tell perhaps.
A0099,L0023,Email,Networked multi-state utilization,2025-06-11,True,Player sell movement grow movement. Town full anything wife speech teach bit both.
A0100,L0099,Email,User-friendly holistic process improvement,2025-04-27,True,Class back difficult safe near world.
A0101,L0183,Demo,Configurable zero-defect core,2025-06-12,True,Note various employee. Country sound can lawyer.
A0102,L0088,Call,Assimilated hybrid task-force,2025-04-29,True,Themselves buy billion yard process. Store throughout line manage green close American.
A0103,L0016,Call,Advanced incremental Graphic Interface,2025-05-26,True,Rock hour also figure key occur. Language trial rest summer four go.
A0104,L0162,Demo,Virtual didactic encryption,2025-05-04,False,In throughout trip feeling civil important. Product gun stage whole.
A0105,L0056,Meeting,Expanded motivating attitude,2025-03-31,False,Talk final cell it practice commercial. Home nation high long every.
A0106,L0087,Follow-up,Exclusive client-server leverage,2025-06-28,True,Check allow list computer successful owner middle truth.
A0107,L0047,Follow-up,Up-sized analyzing utilization,2025-06-22,False,Rate mother successful upon risk. Account scientist such garden lawyer point woman.
A0108,L0153,Demo,Mandatory dynamic data-warehouse,2025-08-06,False,Thank happy once less maybe anything. Position also explain again partner mind.
A0109,L0071,Email,Profound bifurcated artificial intelligence,2025-05-08,True,Actually friend military likely.
A0110,L0124,Follow-up,Object-based optimizing encryption,2025-08-01,False,He common understand stage.
A0111,L0177,Email,Quality-focused mission-critical emulation,2025-06-22,False,Building mind carry our law onto.
A0112,L0114,Demo,Upgradable scalable groupware,2025-04-26,True,Per support that paper pay trouble cut.
A0113,L0117,Follow-up,Distributed bottom-line flexibility,2025-05-08,False,Structure you read.
A0114,L0153,Follow-up,Reactive radical application,2025-03-29,False,Cup page address wrong drop store evidence. Stay no something beautiful media.
A0115,L0138,Demo,Compatible even-keeled secured line,2025-07-09,False,Trouble give general hundred. Central many middle true win forget.
A0116,L0200,Call,Organic dedicated algorithm,2025-05-27,False,Federal oil wait season.
A0117,L0009,Demo,De-engineered executive migration,2025-05-06,True,Item education shake owner. Woman expert main.
A0118,L0032,Meeting,Adaptive mobile open architecture,2025-03-24,False,Station deep he.
A0119,L0003,Demo,Front-line interactive firmware,2025-05-25,False,Chair relationship friend every name full step. Voice message feeling government girl quality.
A0120,L0081,Call,Multi-channeled holistic knowledgebase,2025-06-08,True,Dinner career heart state. Apply member fire reduce father west deal above.
A0121,L0033,Call,Optimized modular array,2025-07-18,False,Term so collection all.
A0122,L0139,Call,Fully-configurable coherent Internet solution,2025-06-11,True,Mr upon case play yeah determine budget.
A0123,L0033,Follow-up,User-friendly bifurcated productivity,2025-03-17,True,Exactly continue order key forget.
A0124,L0035,Email,Implemented eco-centric contingency,2025-07-12,False,Maintain citizen age time watch arrive lay. Station decision Congress computer.
A0125,L0006,Meeting,User-centric context-sensitive system engine,2025-03-30,True,Former form owner local rate benefit lot.
A0126,L0012,Email,Switchable interactive orchestration,2025-03-28,True,Room nice degree reveal office stay health time.
A0127,L0050,Email,Enterprise-wide demand-driven Graphic Interface,2025-07-14,True,Space go area happen.
A0128,L0055,Follow-up,Self-enabling bifurcated complexity,2025-08-07,True,Note future total doctor.
A0129,L0048,Demo,Realigned needs-based standardization,2025-05-09,False,Establish indicate improve time only. Herself animal some pull partner game.
A0130,L0122,Meeting,Face-to-face bifurcated frame,2025-05-29,False,Tonight mission plant police stuff history most.
A0131,L0089,Meeting,Versatile motivating website,2025-07-14,True,Rest certain either college wife television. Degree total always scientist surface establish catch.
A0132,L0075,Call,Multi-tiered secondary focus group,2025-07-02,False,Material late theory agree produce lot trial will.
A0133,L0027,Email,Virtual scalable migration,2025-05-07,True,Create say require. Religious position animal but discussion media.
A0134,L0055,Demo,Distributed optimizing open system,2025-06-04,False,Administration bar vote ok car point while commercial. Music tax huge couple low whether hot.
A0135,L0198,Meeting,Robust zero administration emulation,2025-04-23,False,Beyond second recent left.
A0136,L0048,Demo,Re-engineered explicit solution,2025-05-07,False,Message up long upon happen ability which.
A0137,L0168,Meeting,Down-sized radical conglomeration,2025-04-01,False,Case miss sometimes. This score when always interesting.
A0138,L0166,Demo,Sharable intangible groupware,2025-07-21,True,Hospital best make reveal design.
A0139,L0121,Call,Down-sized 24/7 monitoring,2025-03-24,False,Seem able himself live employee. Newspaper them listen let fall.
A0140,L0138,Follow-up,Horizontal bottom-line project,2025-03-25,True,Voice the speak tonight three. Almost small senior admit.
A0141,L0085,Call,Networked fresh-thinking project,2025-03-27,True,Agreement with offer ask ready. Director manager learn.
A0142,L0109,Meeting,Persevering coherent open architecture,2025-07-29,True,Picture wait consider product after edge third know. We certainly PM represent.
A0143,L0045,Meeting,Versatile bi-directional extranet,2025-07-24,False,Deal purpose arm sell budget heart act. Manage need day behavior gas whole.
A0144,L0094,Follow-up,Fundamental even-keeled ability,2025-07-01,False,Part water avoid more present respond military. Street table occur range appear ok.
A0145,L0173,Meeting,Devolved attitude-oriented installation,2025-08-07,False,Music thus show.
A0146,L0191,Meeting,Seamless human-resource model,2025-05-22,False,Life when ball front then. Population network sea boy house finish rather.
A0147,L0043,Follow-up,Open-architected uniform matrix,2025-05-03,True,Common than soon protect.
A0148,L0171,Meeting,Up-sized multi-tasking encoding,2025-04-24,True,On thus consumer relate up close chance above. Newspaper side deep decade church activity.
A0149,L0023,Demo,Reactive impactful benchmark,2025-06-17,True,Sing write actually employee. Clearly program leg.
A0150,L0021,Email,Fully-configurable impactful protocol,2025-06-05,True,Interest state find state name compare. Spring learn cover natural situation we run thought.
A0151,L0089,Demo,Multi-channeled encompassing info-mediaries,2025-07-26,False,Owner society course policy special. Artist quality successful fast.
A0152,L0057,Email,User-friendly didactic analyzer,2025-04-15,True,Standard expect father remember enjoy identify can.
A0153,L0034,Follow-up,Mandatory empowering artificial intelligence,2025-07-15,False,Mind enjoy teacher will government direction best determine.
A0154,L0144,Demo,Optimized 24/7 service-desk,2025-04-14,True,Raise character perform she these meeting.
A0155,L0167,Call,Switchable 24hour portal,2025-03-27,False,Federal course over energy card. Travel south even suggest.
A0156,L0081,Email,Open-source fresh-thinking challenge,2025-04-05,False,Manager big bad fine week even. Half soldier customer wind audience discuss later.
A0157,L0069,Demo,Ergonomic interactive knowledge user,2025-04-02,True,Order family behind indicate program audience.
A0158,L0044,Follow-up,Object-based bottom-line throughput,2025-05-31,True,Grow successful care white.
A0159,L0169,Call,Right-sized system-worthy support,2025-07-14,True,Trade our suddenly several election decide discussion.
A0160,L0009,Meeting,Persistent multi-state frame,2025-07-26,False,Friend face street next.
A0161,L0121,Email,Seamless responsive matrix,2025-06-12,True,Have why moment become teach.
A0162,L0036,Meeting,Exclusive didactic firmware,2025-05-20,False,Get foot recent evening a condition. Stock hard religious not.
A0163,L0149,Meeting,Customizable context-sensitive capability,2025-07-31,True,Wonder share character increase strong coach third business.
A0164,L0081,Email,Multi-lateral 5thgeneration standardization,2025-06-21,True,Value data old popular quickly quality right. One itself small assume become sister model option.
A0165,L0064,Meeting,Customer-focused even-keeled monitoring,2025-06-12,False,Popular single themselves more condition. Long until save last his back.
A0166,L0029,Follow-up,Team-oriented stable alliance,2025-05-02,True,Risk fall nothing find play under study. How happen majority drop worker.
A0167,L0144,Email,Horizontal stable task-force,2025-07-28,True,History fine rule serious even party blood. Become become certain man day one.
A0168,L0164,Follow-up,Sharable 6thgeneration project,2025-06-04,True,Half computer score serve.
A0169,L0082,Demo,Innovative even-keeled Local Area Network,2025-03-22,False,Onto or Congress why safe.
A0170,L0093,Email,Extended 24hour website,2025-04-18,True,Treat decade near idea able.
A0171,L0055,Demo,Expanded asymmetric portal,2025-06-11,False,Record data wide able.
A0172,L0072,Demo,Phased human-resource installation,2025-05-11,True,Value significant thought painting low clearly doctor. Media seem life church audience ever on.
A0173,L0115,Email,Profound homogeneous frame,2025-04-24,False,Happen study couple together. Become Congress center road.
A0174,L0133,Call,Re-contextualized client-driven emulation,2025-05-07,True,Positive present much anyone talk within return.
A0175,L0088,Demo,User-centric uniform orchestration,2025-05-31,True,Evidence building identify road keep. Market sister daughter company.
A0176,L0026,Follow-up,Fully-configurable grid-enabled protocol,2025-07-26,True,Book subject level art those. Really almost drive prevent phone language buy door.
A0177,L0045,Call,Persistent 4thgeneration intranet,2025-06-15,True,Recognize house would guy every. Drop dark special reflect bill me.
A0178,L0070,Demo,Automated object-oriented middleware,2025-03-26,True,Turn control position degree station practice. Admit machine fight everybody pressure.
A0179,L0019,Call,Enterprise-wide didactic secured line,2025-05-11,True,Sit task from over choice. Television city million light sister our top.
A0180,L0005,Email,Assimilated client-server analyzer,2025-03-24,True,Himself chance wall knowledge summer add discover according.
A0181,L0032,Call,Reactive actuating groupware,2025-05-06,True,Sort some member on.
A0182,L0021,Call,Up-sized neutral system engine,2025-03-31,False,Argue put person month manager sound force government. As member national thousand.
A0183,L0096,Meeting,Horizontal systematic implementation,2025-06-01,True,Note it forget bad. Before base officer yard around.
A0184,L0114,Demo,Polarized hybrid database,2025-07-09,True,Democratic involve true yeah. Low find clear note.
A0185,L0110,Email,Stand-alone uniform strategy,2025-03-25,False,Later meeting outside ten investment bed painting finish.
A0186,L0051,Follow-up,Virtual 6thgeneration architecture,2025-06-13,False,Father that serve fire civil face democratic. Use other kid from.
A0187,L0083,Call,Centralized executive toolset,2025-04-05,False,Include include major pick.
A0188,L0045,Meeting,Enhanced eco-centric installation,2025-04-06,False,Region idea a boy. Most with animal market they idea eat.
A0189,L0154,Call,Public-key encompassing Graphic Interface,2025-03-15,True,Soldier such day teach off expert common of. Rule upon wait realize specific keep.
A0190,L0172,Email,Digitized client-driven analyzer,2025-06-28,True,Event fire write coach. Popular nice employee alone recognize after charge.
A0191,L0132,Follow-up,Phased secondary interface,2025-03-10,False,Those nothing every top employee. Ever identify idea should apply station.
A0192,L0192,Email,User-centric didactic open system,2025-05-03,False,Safe right event edge far.
A0193,L0029,Meeting,Cloned next generation Internet solution,2025-03-24,False,Unit somebody rate site worry respond. Magazine this either kid thing article skin.
A0194,L0191,Email,Quality-focused multi-state synergy,2025-05-26,True,Mrs old adult security spring art option.
A0195,L0009,Email,Team-oriented empowering standardization,2025-04-07,False,Everybody station treat ask.
A0196,L0031,Email,Decentralized regional matrices,2025-04-24,True,State more win treatment.
A0197,L0034,Email,Decentralized optimizing moderator,2025-04-27,False,Among agreement game shake.
A0198,L0020,Follow-up,Cloned homogeneous complexity,2025-03-27,False,Give soldier support season tonight. Glass everyone common.
A0199,L0021,Email,Focused web-enabled algorithm,2025-03-15,True,Mother ground serve else section.
A0200,L0133,Follow-up,Synergized 4thgeneration focus group,2025-07-06,True,Painting new lead.
A0201,L0174,Follow-up,Right-sized actuating application,2025-06-04,False,Partner career feeling be such red door. Political society tree.
A0202,L0174,Follow-up,Automated demand-driven contingency,2025-05-20,False,Mention society treatment follow beautiful.
A0203,L0159,Meeting,Open-architected dedicated moderator,2025-03-11,False,Sport drop just nor. Research huge back lose.
A0204,L0133,Demo,Proactive holistic orchestration,2025-07-10,True,Far possible eight suggest few claim. Huge again without support great wonder try.
A0205,L0144,Demo,Down-sized cohesive time-frame,2025-08-01,False,Necessary less next reveal strategy do list glass. Evidence ahead want stop stock draw until seat.
