ActivityID,LeadID,ActivityType,Subject,DueDate,Completed,Notes
A0412,L0147,Call,Mandatory cohesive task-force,2025-07-29,False,Suggest hear item land manager movement office possible.
A0413,L0056,Email,Face-to-face needs-based project,2025-07-22,False,Identify challenge run full north quite provide six. Despite fact building write.
A0414,L0170,Follow-up,Virtual intangible workforce,2025-04-06,False,Information role common anything help.
A0415,L0151,Call,Reverse-engineered high-level access,2025-04-29,False,Stand I strategy alone.
A0416,L0182,Call,Exclusive asynchronous architecture,2025-03-09,True,Very now teach nice. Into blood miss thus dinner.
A0417,L0086,Email,Streamlined user-facing forecast,2025-05-20,False,Paper threat yourself president. During myself sea religious consider court.
A0418,L0163,Follow-up,Robust 5thgeneration initiative,2025-03-19,True,Effort others serious style. Truth shoulder Democrat.
A0419,L0115,Demo,Sharable reciprocal product,2025-06-26,True,Clearly president song imagine box last.
A0420,L0117,Call,Expanded national process improvement,2025-07-26,True,Citizen race daughter clear.
A0421,L0014,Demo,Cloned local paradigm,2025-04-10,False,Would key family day family environment. Song prove statement institution state.
A0422,L0044,Call,Persistent upward-trending knowledge user,2025-06-25,False,Threat interest animal like. Box already compare character fact.
A0423,L0101,Email,Innovative exuding conglomeration,2025-04-02,False,Less hundred cultural international term mind fill.
A0424,L0084,Call,Reverse-engineered intangible structure,2025-08-03,True,Activity each dog.
A0425,L0078,Email,Versatile solution-oriented alliance,2025-07-29,False,Despite contain event air it agency. Design soon although southern spring value describe safe.
A0426,L0015,Call,Integrated encompassing solution,2025-06-29,True,Organization individual trade theory scientist game build. Hard you always quickly dog carry drug.
A0427,L0136,Follow-up,Stand-alone non-volatile flexibility,2025-07-27,False,Get certain amount director Congress take carry. Firm letter page evening money.
A0428,L0163,Follow-up,Organic system-worthy monitoring,2025-05-19,True,Decision commercial change home. Especially option son in.
A0429,L0011,Email,Ergonomic maximized methodology,2025-06-13,False,Note sure heavy building drive.
A0430,L0078,Meeting,Compatible uniform conglomeration,2025-05-11,True,Worry gas mother people painting different recently. Value once customer.
A0431,L0196,Meeting,Realigned foreground monitoring,2025-05-12,True,Day simple personal meeting shake family town.
A0432,L0026,Email,Horizontal explicit algorithm,2025-04-27,False,None much visit chair return. Lose national happen in.
A0433,L0181,Meeting,Organic zero-defect success,2025-07-30,True,Maybe sound letter turn arrive public.
A0434,L0175,Follow-up,Profound exuding definition,2025-06-15,True,Exist born receive measure be while card.
A0435,L0072,Demo,Customizable 24/7 system engine,2025-06-21,True,Hundred knowledge him.
A0436,L0033,Follow-up,Extended attitude-oriented toolset,2025-06-07,True,Baby check federal better left. Rate figure other girl now heart.
A0437,L0107,Meeting,Re-engineered real-time application,2025-03-23,False,Involve special alone most Republican media toward.
A0438,L0007,Demo,Function-based coherent flexibility,2025-07-09,True,Together drop right.
A0439,L0138,Demo,Visionary explicit Local Area Network,2025-05-27,False,Guy weight spend impact.
A0440,L0100,Email,Robust non-volatile hierarchy,2025-07-11,True,Skin part ability treat smile.
A0441,L0035,Meeting,Innovative reciprocal task-force,2025-05-06,False,Stop tax great keep that shake also. Also yard remain not ten west.
A0442,L0136,Demo,Total optimizing concept,2025-06-24,True,Worker reach although game. Away science how adult smile down.
A0443,L0063,Meeting,Pre-emptive uniform moderator,2025-05-13,False,Deal picture every oil remember despite of program. Indeed its option receive letter.
A0444,L0002,Call,Realigned systemic installation,2025-05-25,False,Unit how serious truth benefit region action.
A0445,L0059,Email,Decentralized directional groupware,2025-03-14,False,More wall follow question appear amount. Part trade situation give easy.
A0446,L0155,Follow-up,Intuitive coherent task-force,2025-07-22,False,Security step energy to easy. South memory media role fact newspaper conference.
A0447,L0130,Demo,User-centric eco-centric pricing structure,2025-04-04,True,Not maintain that tree customer assume. Key whole life another people.
A0448,L0130,Follow-up,Seamless zero tolerance challenge,2025-04-19,False,Peace each event relationship score ground prevent.
A0449,L0054,Call,Assimilated encompassing data-warehouse,2025-04-25,True,Read push happen month. Begin sometimes figure director arrive man project.
A0450,L0168,Email,Multi-layered 3rdgeneration paradigm,2025-05-16,True,When human religious season much mean performance.
A0451,L0130,Meeting,Profit-focused systematic throughput,2025-06-13,True,Action significant throughout throw. Theory box bar hour they.
A0452,L0082,Email,Public-key empowering workforce,2025-06-14,False,Expect country current mouth behavior thought. During trouble physical firm office.
A0453,L0105,Email,Customer-focused next generation algorithm,2025-06-15,False,Thank return act future adult tonight.
A0454,L0056,Call,Public-key local utilization,2025-07-10,True,Realize player purpose board and. Make serious past once none.
A0455,L0110,Call,Multi-layered contextually-based attitude,2025-05-01,True,Rest various fish fill now control among least. If none throughout person recognize arrive.
A0456,L0125,Meeting,Future-proofed tertiary open system,2025-05-21,True,Himself my career. Artist lose suggest religious.
A0457,L0165,Demo,Stand-alone demand-driven matrix,2025-05-20,False,Discuss create network hundred above theory. Customer discussion happy total.
A0458,L0129,Demo,Up-sized background matrix,2025-06-05,True,Expect style behind.
A0459,L0177,Email,Quality-focused neutral orchestration,2025-04-27,True,Type step take so film organization ten forget.
A0460,L0006,Meeting,Exclusive dedicated open architecture,2025-07-12,False,Then evening the phone scene they.
A0461,L0173,Meeting,Reactive homogeneous Local Area Network,2025-05-30,True,Speak here like think production weight one those. Account former friend toward.
A0462,L0150,Email,Cross-group mobile task-force,2025-04-13,False,Fight job surface choose case draw. Successful yet political.
A0463,L0165,Call,Distributed system-worthy circuit,2025-04-15,True,Cost begin speak likely. Hotel reason these style stage mother add side.
A0464,L0102,Email,Cross-group well-modulated methodology,2025-03-29,True,Young wish red subject thought hot. Edge inside both open special material election.
A0465,L0118,Email,Re-contextualized optimal collaboration,2025-05-09,False,Kitchen president camera ok. Base toward always stand.
A0466,L0037,Call,Function-based bifurcated complexity,2025-04-20,True,To approach identify. Letter well recognize budget instead voice.
A0467,L0183,Follow-up,Re-contextualized impactful monitoring,2025-04-02,False,City risk picture which around. Law history ok training.
A0468,L0018,Demo,Up-sized actuating strategy,2025-06-12,True,Center member source interview. More age industry challenge model such.
A0469,L0145,Meeting,User-friendly object-oriented projection,2025-03-13,False,Memory put have test cause note.
A0470,L0117,Call,Persevering intermediate workforce,2025-07-17,True,List their expert sister really.
A0471,L0044,Meeting,Optimized bottom-line workforce,2025-06-15,False,Newspaper wall development test only. Raise reveal product song hand lead represent value.
A0472,L0006,Demo,Fully-configurable 5thgeneration standardization,2025-05-17,False,Across short machine tax move. Task evidence together series author.
A0473,L0088,Email,Realigned eco-centric conglomeration,2025-04-06,False,Military picture step our.
A0474,L0064,Demo,Profound stable time-frame,2025-04-25,False,System everything nature. Southern yeah seat three return tonight together.
A0475,L0099,Call,Visionary dynamic encryption,2025-03-19,False,Him perform science light society result. Machine almost rich majority quality beat fear.
A0476,L0138,Call,Cloned dedicated core,2025-07-12,True,Pressure spend of teach history. Guess team data piece.
A0477,L0019,Call,Customer-focused 24/7 interface,2025-06-25,True,Paper point however.
A0478,L0083,Meeting,Reduced dynamic migration,2025-04-22,False,Cup teach can the.
A0479,L0016,Meeting,Open-architected well-modulated definition,2025-06-01,True,That commercial staff remember have. Story minute relate any attorney hot.
A0480,L0040,Follow-up,Visionary multi-state migration,2025-08-05,True,Sometimes writer way case office since commercial in. Own manage laugh out foreign.
A0481,L0062,Call,User-friendly intangible algorithm,2025-04-01,True,Material share analysis information.
A0482,L0069,Demo,Automated mobile capability,2025-07-12,False,Long policy decision tax success century. Price yourself listen subject style candidate simple standard.
A0483,L0043,Demo,Business-focused fault-tolerant encoding,2025-05-23,False,Government television character country but.
A0484,L0147,Email,User-centric 3rdgeneration Internet solution,2025-04-25,False,Individual rather bar meeting how seat gun million.
A0485,L0179,Meeting,Centralized object-oriented access,2025-05-06,True,Glass cell they assume management consider final. Vote start detail decision cut age data threat.
A0486,L0014,Call,Optimized directional database,2025-06-24,True,Its learn because institution. Range herself operation investment.
A0487,L0197,Demo,Optional 4thgeneration hardware,2025-05-08,False,Account player art. Nation you mother all style.
A0488,L0187,Follow-up,Monitored local attitude,2025-05-17,False,Actually a run edge treatment and.
A0489,L0005,Demo,Adaptive systemic neural-net,2025-04-24,False,Sea before language water.
A0490,L0007,Meeting,Balanced cohesive productivity,2025-05-12,False,Determine whom manage team. Bad strong whatever bring identify smile later.
A0491,L0181,Call,Optional bandwidth-monitored initiative,2025-07-04,False,Cost administration management politics air.
A0492,L0118,Email,Advanced leadingedge standardization,2025-04-14,False,Must little positive tough avoid reach customer.
A0493,L0108,Meeting,Phased disintermediate flexibility,2025-05-11,True,Turn without visit TV.
A0494,L0048,Meeting,Networked optimal circuit,2025-07-17,False,Choose official thing.
A0495,L0159,Demo,Profit-focused disintermediate superstructure,2025-03-19,False,Chance sport agree.
A0496,L0035,Email,Enterprise-wide neutral budgetary management,2025-07-27,False,Break drop likely chance. Recognize address difference real toward want clearly black.
A0497,L0162,Demo,Right-sized object-oriented extranet,2025-06-27,True,Model ready letter increase. Speak tax lawyer.
A0498,L0081,Demo,Cross-group client-server array,2025-03-12,False,Write set floor crime school. It support nice wait agreement individual.
A0499,L0044,Follow-up,Implemented optimal success,2025-06-11,False,Project lawyer environment million evening purpose.
A0500,L0094,Demo,Fundamental motivating complexity,2025-07-12,True,Environment people behind middle price senior myself.
