ActivityID,LeadID,ActivityType,Subject,DueDate,Completed,Notes
A0206,L0193,Demo,Function-based directional system engine,2025-06-23,True,Let forward trouble.
A0207,L0132,Follow-up,Future-proofed multimedia artificial intelligence,2025-07-10,True,Future various face bank bill.
A0208,L0035,Call,Optimized global moratorium,2025-07-26,True,Daughter face off believe resource. Note sort spend away.
A0209,L0044,Follow-up,Managed radical project,2025-04-24,True,Exist buy simply develop nor.
A0210,L0136,Email,Persistent tangible access,2025-05-25,False,Nature evidence second prepare Congress rock specific. Kid Congress here between senior true.
A0211,L0195,Meeting,Cross-group optimizing portal,2025-07-13,True,Executive oil past his economy. Prepare who cost drop growth.
A0212,L0073,Demo,Ameliorated neutral emulation,2025-05-15,True,Evidence space five base computer. Wife different amount last center million.
A0213,L0172,Meeting,Proactive 24hour implementation,2025-07-26,True,Guess movement poor different tax for.
A0214,L0019,Follow-up,Reactive actuating system engine,2025-04-10,True,Sell knowledge want stand.
A0215,L0193,Follow-up,Organic 5thgeneration matrices,2025-07-14,False,Wife theory PM same baby. Since name care fight throw.
A0216,L0093,Email,Adaptive full-range database,2025-03-24,True,Reduce film exist property free.
A0217,L0162,Demo,Cloned coherent moratorium,2025-07-22,False,Per story reason score.
A0218,L0146,Demo,Re-engineered hybrid throughput,2025-06-08,True,Agreement party pull box image. Outside design subject face.
A0219,L0088,Meeting,Innovative systematic contingency,2025-07-23,True,Experience role animal specific moment answer. Very year front.
A0220,L0054,Meeting,Vision-oriented dedicated strategy,2025-06-07,False,Push case church meet development less.
A0221,L0057,Follow-up,Grass-roots bifurcated extranet,2025-03-13,True,Yet both travel big kitchen ahead beat away.
A0222,L0188,Demo,Expanded empowering matrices,2025-04-15,True,Her message audience positive sort appear have race. Like individual despite husband.
A0223,L0122,Meeting,Team-oriented optimal standardization,2025-07-31,False,Rest wear everybody build probably. Trial now section support would.
A0224,L0118,Email,Visionary system-worthy artificial intelligence,2025-05-29,True,Explain hold consider report. Support at there true pay.
A0225,L0160,Meeting,Self-enabling multi-state moderator,2025-07-24,True,Anything year agree rate trouble trial. Once reality look cover.
A0226,L0134,Demo,Function-based zero administration ability,2025-05-27,False,Big each ground interesting agency. Total agency type.
A0227,L0005,Meeting,De-engineered 4thgeneration forecast,2025-05-13,True,Car society be heart inside.
A0228,L0198,Demo,User-friendly clear-thinking Internet solution,2025-07-19,True,Right half pretty ahead. Just measure each couple record.
A0229,L0160,Follow-up,Monitored zero tolerance throughput,2025-08-07,False,Prevent grow offer laugh drug.
A0230,L0144,Call,Multi-tiered actuating system engine,2025-05-21,True,Inside American measure remember first.
A0231,L0100,Follow-up,User-centric global moratorium,2025-05-14,True,Mrs perhaps black last. Realize suffer all.
A0232,L0138,Meeting,Progressive contextually-based portal,2025-03-10,True,Discover fire common staff education must.
A0233,L0040,Call,Automated scalable core,2025-03-31,True,Training her quickly type society.
A0234,L0124,Call,Fully-configurable web-enabled circuit,2025-06-13,False,Yeah institution senior newspaper couple. Learn share though somebody event city whatever four.
A0235,L0079,Follow-up,Extended modular customer loyalty,2025-04-13,False,Opportunity think way.
A0236,L0199,Follow-up,Progressive empowering Graphic Interface,2025-04-03,False,Which phone guy into arm fall.
A0237,L0001,Follow-up,Cross-platform exuding encryption,2025-06-28,True,Discussion practice mind shake several. Ten prevent try low.
A0238,L0117,Follow-up,Seamless contextually-based system engine,2025-07-04,False,Need hard increase admit forget major table.
A0239,L0063,Meeting,Progressive heuristic info-mediaries,2025-05-08,False,Term born detail yet.
A0240,L0027,Call,Business-focused national workforce,2025-04-26,True,Always begin difficult own want.
A0241,L0042,Email,Polarized asymmetric info-mediaries,2025-04-20,False,Prevent training show audience ground.
A0242,L0145,Email,Operative needs-based benchmark,2025-03-10,True,Owner campaign second total camera would head. Six protect need possible else degree lead.
A0243,L0145,Demo,Down-sized analyzing knowledge user,2025-07-05,True,Memory health these series. Seat partner soldier decide read water story.
A0244,L0080,Email,Team-oriented incremental forecast,2025-03-11,False,Recently another pass allow plant type. Water lot simply return tonight idea.
A0245,L0172,Demo,Multi-channeled homogeneous contingency,2025-06-26,False,Cup meet event stock police fast friend.
A0246,L0185,Call,Organic tertiary intranet,2025-05-20,True,Hair bank control.
A0247,L0053,Follow-up,Focused stable collaboration,2025-04-10,True,Board lot cause all answer huge turn.
A0248,L0022,Demo,Upgradable non-volatile implementation,2025-04-19,True,Type institution night theory window poor difference. Employee behind service well garden indeed wait.
A0249,L0137,Demo,Realigned foreground matrix,2025-07-26,True,Land third suffer hard idea gas catch. Significant many career office economy Democrat several.
A0250,L0054,Follow-up,Operative mobile database,2025-05-17,False,Actually newspaper state lay simply house. Accept writer statement often at report court.
A0251,L0077,Call,Fundamental radical task-force,2025-06-27,True,Represent tend return cut cost reduce stand drop. All several director student.
A0252,L0018,Meeting,Ergonomic local focus group,2025-05-27,False,Current provide rich produce. Visit seat ago school herself however avoid technology.
A0253,L0037,Email,Customizable regional projection,2025-05-29,True,Certainly be occur pressure think. Could stage total administration nor order.
A0254,L0018,Demo,Adaptive heuristic workforce,2025-05-11,True,Choose finally tax current. Daughter development ability which another some education.
A0255,L0132,Meeting,User-friendly intermediate help-desk,2025-04-28,False,Husband level soldier accept leader local.
A0256,L0051,Follow-up,Virtual impactful attitude,2025-07-19,False,Room central up concern article miss cell. Challenge smile ten glass.
A0257,L0151,Demo,Fundamental responsive encryption,2025-05-21,False,Remain sport rule detail window.
A0258,L0188,Email,Stand-alone interactive instruction set,2025-04-22,False,Important drive book contain hotel voice figure few. Treat director country data art.
A0259,L0035,Email,Up-sized maximized installation,2025-07-01,True,Skin nearly describe.
A0260,L0105,Demo,Upgradable zero-defect help-desk,2025-05-30,False,Lay kitchen several here open still.
A0261,L0065,Meeting,Inverse holistic moratorium,2025-08-03,False,Industry they forget however teach. Democrat commercial whatever rather.
A0262,L0090,Call,Devolved multi-tasking array,2025-07-11,True,Girl debate believe sign customer listen kid.
A0263,L0055,Demo,Synchronized systemic Graphical User Interface,2025-06-10,True,Thank front professional though husband interview. Prove factor about position.
A0264,L0114,Demo,Implemented full-range hub,2025-04-05,True,Party happen list on perhaps concern. Hundred hundred throw leave book his goal.
A0265,L0173,Email,Enhanced national moratorium,2025-05-14,True,Treatment information go occur language. Man note politics.
A0266,L0114,Follow-up,Inverse transitional policy,2025-07-26,False,Such this space chair focus. President fear father opportunity detail story amount.
A0267,L0123,Call,Optimized methodical definition,2025-05-09,True,Policy around challenge look technology.
A0268,L0058,Call,Proactive cohesive hub,2025-08-06,True,Owner himself become.
A0269,L0137,Demo,Customizable grid-enabled Graphic Interface,2025-06-21,True,Recently water three measure address commercial street product.
A0270,L0036,Email,Stand-alone needs-based algorithm,2025-08-06,False,War against day key. House stay dinner realize.
A0271,L0099,Meeting,Upgradable zero-defect pricing structure,2025-03-22,True,Health you fly series. Direction couple cell end figure environmental.
A0272,L0150,Follow-up,Fully-configurable maximized groupware,2025-04-22,False,Value either already far page.
A0273,L0009,Email,Fully-configurable radical challenge,2025-06-11,False,Type figure from security sit week bag.
A0274,L0143,Demo,Right-sized analyzing help-desk,2025-03-11,True,Wide natural site approach trade run. Name interest perhaps consumer simply everything mean.
A0275,L0003,Meeting,Digitized fault-tolerant software,2025-07-25,False,Election hotel office phone think charge.
A0276,L0050,Meeting,Right-sized background help-desk,2025-07-16,False,Majority catch fire against lawyer until argue. Station dream alone box today.
A0277,L0032,Email,Streamlined secondary structure,2025-04-28,False,Factor eight agree whose. Film walk clearly since audience figure behind.
A0278,L0076,Demo,Innovative encompassing knowledgebase,2025-06-25,False,Toward wrong offer painting whom state example. Bill talk style.
A0279,L0160,Demo,User-centric optimizing methodology,2025-07-21,True,Add forward simply structure school imagine. Almost put drug science door take new service.
A0280,L0008,Call,User-friendly multimedia paradigm,2025-04-30,True,Bed them pull player range TV simply. Money affect per great.
A0281,L0134,Meeting,Synergistic 4thgeneration emulation,2025-06-04,False,Top option small section.
A0282,L0119,Call,Open-source bi-directional hardware,2025-08-06,True,Save hand why compare. Back image anything land picture suddenly situation.
A0283,L0121,Email,Reverse-engineered composite hub,2025-04-24,True,Ahead country own air fish. Service responsibility time sure bit.
A0284,L0074,Demo,Synergistic foreground structure,2025-07-09,False,Stuff eight everybody according sport single.
A0285,L0010,Email,Customizable maximized throughput,2025-04-23,False,Real yard report force main paper. Economy language American culture community.
A0286,L0147,Demo,Multi-tiered value-added secured line,2025-06-02,False,City important analysis there real attention.
A0287,L0009,Email,Re-contextualized local data-warehouse,2025-08-04,True,Hold pattern maybe away impact eight. Enjoy company pattern international actually each.
A0288,L0128,Follow-up,Total responsive customer loyalty,2025-05-11,True,Bring hold drop new example on.
A0289,L0056,Email,Public-key multi-state emulation,2025-06-04,False,Beat production report chair store. Civil expert last large not certainly.
A0290,L0085,Call,Up-sized impactful pricing structure,2025-05-23,False,Without look father sure environment. Statement science forget police argue ok difficult.
A0291,L0129,Call,Expanded 4thgeneration implementation,2025-07-23,False,Same start least population.
A0292,L0183,Follow-up,Organized well-modulated flexibility,2025-04-14,True,Rest point religious occur study room. President cultural their cultural security source.
A0293,L0015,Follow-up,Phased intermediate array,2025-04-27,True,Learn fine speak easy head similar. To month art could bank ability.
A0294,L0101,Email,Quality-focused tertiary encoding,2025-04-01,True,Young sea travel tax. Challenge blood most herself report side.
A0295,L0066,Email,Profound upward-trending array,2025-06-19,True,While view country think eye might color.
A0296,L0006,Meeting,Open-source empowering contingency,2025-06-22,False,Soldier positive name their stop. Box agree maybe.
A0297,L0089,Demo,Synergized tertiary middleware,2025-07-21,True,Officer guy leader. Back hot himself she series toward month.
A0298,L0098,Demo,Fundamental eco-centric superstructure,2025-04-21,False,Player sport less determine everybody. Probably among energy.
A0299,L0025,Follow-up,Face-to-face web-enabled capacity,2025-05-28,False,Woman oil add series meeting something.
A0300,L0164,Call,User-centric analyzing circuit,2025-06-15,False,Learn ability among sense. Trip along police focus would grow analysis final.
A0301,L0059,Email,User-friendly static hub,2025-06-24,False,Course significant money key president. Wish project actually send.
A0302,L0003,Call,Automated multimedia moderator,2025-07-03,True,Lay stage arm several. Whom product two author kind.
A0303,L0111,Follow-up,Cloned neutral archive,2025-03-14,True,Court message let tax nice doctor. Range current responsibility cost join collection bar letter.
A0304,L0088,Follow-up,Organic 4thgeneration encryption,2025-05-24,False,Situation ground close computer use Republican agent. Career main sense base.
A0305,L0200,Demo,Profit-focused needs-based budgetary management,2025-03-22,False,Left will including evening. Officer go pick more fire there.
A0306,L0059,Call,Reduced methodical workforce,2025-05-15,False,Action political color think ten area.
A0307,L0148,Email,Universal zero administration open architecture,2025-07-14,True,Factor shake either explain record. Offer natural herself force summer.
A0308,L0196,Call,Persistent zero administration model,2025-06-25,True,Help risk land child hot would cover.
A0309,L0140,Meeting,Fully-configurable needs-based focus group,2025-07-24,False,Glass itself agency. Community similar anything.
A0310,L0010,Meeting,Automated local groupware,2025-06-06,False,Career thought which condition hope. Born manage society popular.
A0311,L0066,Email,De-engineered well-modulated initiative,2025-06-22,True,Game push doctor wear. Final would view report public.
A0312,L0063,Call,Automated disintermediate concept,2025-06-11,False,Full answer base fly sit.
A0313,L0025,Follow-up,Virtual interactive hierarchy,2025-03-30,True,Not water break trade describe production certainly hit. Page task bad situation suffer hope character speech.
A0314,L0158,Demo,Realigned executive secured line,2025-04-13,True,She style issue some player. Someone go begin state sure home heavy.
A0315,L0078,Follow-up,Sharable value-added function,2025-06-05,True,Short how bad but above hair.
A0316,L0119,Email,Fundamental zero administration framework,2025-04-22,True,Kid finally card best happen whole everybody. Perform low style direction deal month according.
A0317,L0191,Email,Realigned user-facing concept,2025-06-26,False,Goal seat look market he continue.
A0318,L0176,Call,Exclusive leadingedge Internet solution,2025-06-11,False,Scene local expect single. Fly road organization.
A0319,L0131,Meeting,Secured value-added policy,2025-07-07,False,Model leader approach technology would side.
A0320,L0019,Email,Cross-platform local architecture,2025-04-29,False,Military operation center team their whose fire above.
A0321,L0178,Email,Function-based secondary task-force,2025-06-09,False,Free we half you. Large near morning change interesting.
A0322,L0165,Follow-up,Centralized 4thgeneration utilization,2025-04-05,False,Continue experience fly during high road. Individual card accept entire floor.
A0323,L0198,Demo,Horizontal fresh-thinking parallelism,2025-07-04,True,Response friend reflect piece agreement. Animal law on agree.
A0324,L0154,Call,Phased systemic budgetary management,2025-04-06,True,Class bit risk treatment this work.
A0325,L0156,Call,Future-proofed stable synergy,2025-07-11,True,Admit concern and hard garden support very.
A0326,L0059,Meeting,Horizontal 6thgeneration circuit,2025-03-27,False,Upon poor sit discuss then manage hard.
A0327,L0135,Email,Reverse-engineered discrete conglomeration,2025-05-28,False,Else between author dog explain. Education thus technology tonight have international.
A0328,L0181,Demo,Re-contextualized zero tolerance extranet,2025-05-15,True,Right current explain parent. High job most build.
A0329,L0051,Demo,Balanced bi-directional methodology,2025-07-20,False,Opportunity attack mean quality.
A0330,L0080,Demo,Multi-channeled zero administration open architecture,2025-08-03,True,Smile huge bar trip ok today word.
A0331,L0001,Follow-up,Pre-emptive composite interface,2025-05-13,True,Charge democratic view write break moment job.
A0332,L0087,Demo,Synergized real-time budgetary management,2025-06-18,False,Citizen one return himself senior.
A0333,L0062,Meeting,Progressive systematic forecast,2025-06-14,False,South believe serious miss peace. Theory quite give very wide laugh.
A0334,L0186,Call,Secured intermediate focus group,2025-06-23,True,Church remain whom whom throw response.
A0335,L0149,Call,Networked upward-trending extranet,2025-06-08,True,Admit have get. Peace medical already day simple during.
A0336,L0084,Follow-up,Reverse-engineered neutral hierarchy,2025-08-01,False,Writer message community somebody home history. Also health art left outside.
A0337,L0148,Email,Cloned intermediate utilization,2025-07-19,True,Eight really international admit suffer region.
A0338,L0059,Demo,Decentralized needs-based workforce,2025-05-22,True,Affect million represent next. Thing although open one issue.
A0339,L0054,Call,Fundamental demand-driven architecture,2025-04-20,True,Professor same must consider blood.
A0340,L0186,Call,Fundamental cohesive success,2025-06-28,False,Born professor rather risk defense.
A0341,L0008,Demo,Switchable radical focus group,2025-06-03,False,Choose hand almost material. Study public reveal break place keep.
A0342,L0067,Meeting,Phased fresh-thinking matrix,2025-07-26,True,Appear president recently kitchen catch mission move. Operation the cover address central.
A0343,L0138,Email,Innovative bi-directional task-force,2025-06-22,False,Side feel TV off surface.
A0344,L0064,Follow-up,Multi-tiered reciprocal approach,2025-07-04,False,Return remember agent away guess. Specific memory huge decade write.
A0345,L0171,Email,Configurable homogeneous paradigm,2025-04-02,True,Through drive care.
A0346,L0087,Call,Adaptive 24hour data-warehouse,2025-06-22,True,Red security staff guess represent large figure. Nearly small quickly next.
A0347,L0189,Call,Down-sized 5thgeneration moderator,2025-07-30,True,Usually close activity prove current.
A0348,L0156,Follow-up,Optimized mission-critical secured line,2025-08-05,True,Method order coach huge month. Stock war fall.
A0349,L0170,Demo,Managed grid-enabled Internet solution,2025-07-21,True,Trade nation song responsibility cell maintain risk old.
A0350,L0058,Follow-up,De-engineered optimizing array,2025-04-12,True,Prevent whom skin policy beyond late. Draw reason floor environmental should.
A0351,L0153,Email,Integrated mobile success,2025-06-27,False,Win model onto subject practice contain dinner. Key argue recognize quality you.
A0352,L0114,Follow-up,Fully-configurable demand-driven system engine,2025-06-30,False,Range job hold air. Young owner power quality sell pass attack.
A0353,L0033,Meeting,Horizontal systematic project,2025-04-25,False,Tree sit pass customer thing. Professional right suffer artist choice.
A0354,L0052,Demo,Face-to-face web-enabled data-warehouse,2025-07-01,False,Somebody realize business. Because always week sound.
A0355,L0099,Demo,Multi-layered impactful orchestration,2025-05-24,False,Product decision onto such. Ability age single today.
A0356,L0090,Demo,Polarized methodical software,2025-03-25,True,Discussion TV campaign talk top clear. Meeting themselves nature thing.
A0357,L0188,Demo,Devolved client-driven benchmark,2025-06-15,True,Much business serve.
A0358,L0096,Email,Front-line asynchronous migration,2025-07-20,False,Most down anything article lose.
A0359,L0170,Meeting,Synergized motivating frame,2025-05-15,False,Else month such company while rate many entire.
A0360,L0134,Meeting,Inverse non-volatile contingency,2025-07-15,False,Word successful second standard daughter.
A0361,L0079,Meeting,Visionary encompassing middleware,2025-04-06,True,Interview none eye daughter film main.
A0362,L0067,Email,Polarized national open architecture,2025-04-11,False,Audience receive wonder teach tend dark.
A0363,L0025,Meeting,Front-line leadingedge approach,2025-03-26,True,One per serious treat. Student travel prevent air some social class suffer.
A0364,L0076,Demo,Monitored eco-centric middleware,2025-04-09,True,Career body whole dog. None than during term throughout personal firm.
A0365,L0197,Demo,Switchable hybrid system engine,2025-05-11,True,Hundred key medical fact child will as. Score marriage pretty care night east.
A0366,L0103,Email,Up-sized mobile help-desk,2025-03-18,False,Congress poor budget loss travel difficult anything.
A0367,L0025,Demo,Reverse-engineered heuristic infrastructure,2025-07-21,False,Number create door learn.
A0368,L0060,Call,Upgradable optimal analyzer,2025-04-24,True,End hotel poor purpose similar perform. Option involve exactly customer job.
A0369,L0144,Demo,Stand-alone intermediate synergy,2025-07-04,True,Enjoy cost necessary here. Best so why nor cold article should.
A0370,L0009,Call,Advanced well-modulated database,2025-07-13,True,Open animal population arm view. Country environment take.
A0371,L0081,Demo,Expanded impactful task-force,2025-05-15,True,Investment executive back leave land skill.
A0372,L0152,Meeting,Managed eco-centric Graphical User Interface,2025-07-02,True,Support concern detail degree easy others task.
A0373,L0176,Meeting,Object-based secondary array,2025-07-29,False,Type include could fish Democrat for language. Tree eight teacher.
A0374,L0149,Demo,Virtual dedicated parallelism,2025-03-28,True,Suddenly focus bank member. Their teach show the note.
A0375,L0025,Call,Reduced fault-tolerant budgetary management,2025-07-31,False,Message half energy look him interest article. Decade final why fast.
A0376,L0045,Email,Secured scalable utilization,2025-03-19,True,Their us another foreign.
A0377,L0169,Call,Implemented motivating system engine,2025-07-08,True,Toward still minute analysis push key important. Very center total air history role price.
A0378,L0142,Follow-up,Robust reciprocal hub,2025-06-14,True,Maintain price care already task watch. Training skill scientist.
A0379,L0183,Meeting,Intuitive real-time algorithm,2025-03-12,True,Want campaign option last.
A0380,L0076,Email,Organic cohesive architecture,2025-04-22,True,Movie this paper live include professor call.
A0381,L0094,Meeting,Multi-layered interactive orchestration,2025-07-07,False,Market very try other drug represent. Report say cause tough word management.
A0382,L0030,Call,Customer-focused intangible matrix,2025-05-01,True,Natural smile expert.
A0383,L0136,Meeting,Assimilated transitional orchestration,2025-07-03,False,Recent paper area daughter. Enjoy attention exactly measure.
A0384,L0104,Email,Balanced upward-trending matrices,2025-05-31,False,Seek last like could staff court.
A0385,L0074,Demo,Grass-roots hybrid functionalities,2025-06-23,False,Though heart and season play especially season year. Place kid employee free.
A0386,L0137,Call,Seamless system-worthy application,2025-04-18,False,Sense writer over this kind person same. Case last respond voice less subject around.
A0387,L0165,Call,Advanced bi-directional data-warehouse,2025-04-26,False,Analysis consumer any however writer. Society particular leader pressure local within.
A0388,L0158,Call,Synergized static artificial intelligence,2025-06-25,False,Institution either build word space. Class whose current I TV now box.
A0389,L0143,Call,Adaptive motivating product,2025-07-08,False,Local believe view.
A0390,L0036,Email,Intuitive exuding initiative,2025-04-11,False,Occur owner specific good lawyer increase. Top road carry interview charge suffer.
A0391,L0120,Meeting,Customizable zero tolerance database,2025-05-16,True,Cold never ready might quickly do own.
A0392,L0103,Email,Vision-oriented modular Local Area Network,2025-05-05,False,Film benefit type such fact maybe.
A0393,L0122,Demo,Decentralized background knowledgebase,2025-04-29,False,Weight produce candidate. Personal believe four yeah surface tax.
A0394,L0116,Follow-up,Digitized multi-state attitude,2025-03-31,False,Professor yeah often stop television hit.
A0395,L0049,Follow-up,Progressive 24/7 benchmark,2025-08-05,False,Lay war time professor.
A0396,L0067,Call,Pre-emptive multi-state system engine,2025-05-21,True,Medical green majority without will. Talk painting action.
A0397,L0150,Email,Progressive zero administration secured line,2025-07-03,False,Push take hair wife reality.
A0398,L0076,Email,Adaptive foreground success,2025-03-23,False,Minute successful effect safe TV.
A0399,L0138,Demo,Devolved asymmetric process improvement,2025-06-07,True,Everything difficult yet group recent. Loss move particular pressure.
A0400,L0004,Follow-up,De-engineered dedicated interface,2025-03-11,False,Those they control hospital material take.
A0401,L0011,Call,Fundamental system-worthy paradigm,2025-05-20,True,Collection national fly issue opportunity doctor customer. Anything white represent into little test forward difficult.
A0402,L0149,Call,Assimilated next generation function,2025-04-22,True,Most stand find value available spend.
A0403,L0109,Demo,Mandatory 5thgeneration ability,2025-08-02,False,Sometimes theory final. Tree break I.
A0404,L0153,Meeting,Public-key value-added throughput,2025-05-14,False,Protect must walk. Physical husband a out.
A0405,L0032,Follow-up,Profound web-enabled projection,2025-03-12,True,Ok close paper rise. Mouth health find field a serious every.
A0406,L0113,Call,Advanced actuating access,2025-06-05,False,Expert market go right.
A0407,L0116,Email,Extended static toolset,2025-05-22,True,Entire remain wonder start. Prevent idea character staff threat reality.
A0408,L0172,Call,Robust object-oriented capacity,2025-03-19,False,Herself herself growth memory.
A0409,L0001,Meeting,Robust fresh-thinking definition,2025-07-30,True,Push agreement live role item author last.
A0410,L0020,Call,Diverse homogeneous flexibility,2025-06-20,False,Half personal tax will pull radio cell. Partner to scene join.
A0411,L0045,Call,Grass-roots asynchronous task-force,2025-07-26,False,Degree her seven question apply event American.
